"%s","%s"
"The From Date value should be less than or equal to the To Date value.","Giá trị ngày bắt đầu phải nhỏ hơn hoặc bằng giá trị ngày kết thúc ."
"The store code may contain only letters (a-z), numbers (0-9) or underscore(_), the first character must be a letter","Mã cửa hàng chỉ có thể chứa ký tự chữ (a-z), số (0-9) hoặc dấu gạch dưới (_), ký tự đầu tiên phải là chữ"
"The store does not exist","Cửa hàng không tồn tại"
"The store has been deleted.","Cửa hàng đã bị xóa."
"The store has been saved.","Cửa hàng đã được lưu lại."
"The store view has been deleted.","Giao diện cửa hàng đã bị xóa."
"The store view has been saved","Giao diện cửa hàng đã được lưu lại"
"The template Name must not be empty.","Tên mẫu không được để trống."
"The value is not within the specified range.","Giá trị không nằm trong phạm vi chỉ định."
"The website does not exist.","Trang web không tồn tại."
"The website has been deleted.","Trang web đã bị xóa."
"The website has been saved.","Trang web đã được lưu lại."
"Themes","Chủ đề"
"This category and all its child elements","Loại mặt hàng này và tất cả phần tử của nó"
"This category and its child categories only","Chỉ loại mặt hàng này và tất cả loại mặt hàng con của nó"
"This category and its products only","Chỉ loại mặt hàng này và sản phẩm của nó"
"This category only","Chỉ loại mặt hàng này"
"This date is a required value.","Ngày này là một giá trị bắt buộc."
"This is a required field.","Đây là tường bắt buộc."
"This store cannot be deleted.","Không thể xóa cửa hàng này."
"This store view cannot be deleted.","Không thể xóa giao diện cử hàng này."
"This website cannot be deleted.","Không thể xóa trang web này."
"This will be displayed just before body closing tag.","Điều này sẽ được hiển thị ngay trước."
"This will be included before head closing tag in page HTML.","Điều này sẽ bao gồm tag tiêu đề đóng trước đó trong trang HTML."
"Timezone","Múi giờ"
"Title Prefix","Tiền tố tiêu đề"
"Title Suffix","Hậu tố tiêu đề"
"Transactional Emails","Email giao dịch"
"Translate Inline","Dịch nội tuyến"
"Translate, blocks and other output caches should be disabled for both frontend and admin inline translations.","Dịch, khối và các bộ nhớ đệm khác nên được vô hiệu hóa cho cả dịch ở trang giao diện người dùng và quản trị nội tuyến ."
"Translations","Translations"
"Two and more slashes together are not permitted in request path","Đường dẫn yêu cầu không được phép có hơn hai dấu gạch chéo"
"Two and more slashes together are not permitted in url rewrite suffix","Hậu tố URL không được phép có hơn hai dấu gạch chéo"
"Unable to create directory: %s","Không thể tạo thư mục: %s"
"Unable to delete store view. Please, try again later.","Không thể xóa giao diện cửa hàng. Vui lòng thử lại sau."
"Unable to delete store. Please, try again later.","Không thể xóa cửa hàng. Vui lòng thử lại sau."
"Unable to delete website. Please, try again later.","Không thể xóa website. Vui lòng thử lại sau."
"Unable to proceed. Please, try again","Không thể tiến hành. Vui lòng thử lại"
"Unable to proceed. Please, try again.","Không thể tiến hành. Vui lòng thử lại."
"Unable to save file ""%s"" at ""%s""","Không thể lưu tệp ""%s"" tại ""%s"""
"Unable to save file: %s","Không thể lưu tệp: %s"
"Unknown old style column type definition: {$definition}.","Không rõ kiểu cột cũ: {$definition}."
"Unknown scope ""%s"".","Không rõ phạm vi ""%s""."
"Unsecure","Không an toàn"
"Url Options","Tùy chọn URL"
"Use Custom Admin Path","Sử dụng đường dẫn Admin tùy chỉnh"
"Use Custom Admin URL","Sử dụng URL Admin tùy chỉnh"
"Use HTTP Only","Chỉ dùng HTTP"
"Use SID on Frontend","Sử dụng SID trên trang giao diện người dùng"
"Use Secure URLs in Admin","Sử dụng URL an toàn trong quản trị"
"Use Secure URLs in Frontend","Sử dụng URL an toàn ở trang giao diện người dùng"
"Use Web Server Rewrites","Sử dụng ghi đè máy chủ web"
"VAT Number","Mã số VAT"
"Validate HTTP_USER_AGENT","Xác nhận HTTP_USER_AGENT"
"Validate HTTP_VIA","Xác nhận HTTP_VIA"
"Validate HTTP_X_FORWARDED_FOR","Xác nhận HTTP_X_FORWARDED_FOR"
"Validate REMOTE_ADDR","Xác nhận REMOTE_ADDR"
"Validation has failed.","Xác nhận thất bại."
"Values less than 60 are ignored. Note that changes will apply after logout.","Bỏ qua các giá trị dưới 60. Lưu ý rằng những thay đổi sẽ được áp dụng sau khi đăng xuất."
"Variable Code must be unique.","Mã biến số phải là duy nhất."
"Warning! Enabling this feature is not recommended on production environments because it represents a potential security risk.","Cảnh báo! Việc kích hoạt tính năng này không được khuyến khích trên các mục sản phẩm vì nó có thể nguy hại đến bảo mật."
"Web","Web"
"Website","Website"
"Website Information","Thông tin website"
"Website Name","Tên website"
"Website code may only contain letters (a-z), numbers (0-9) or underscore(_), the first character must be a letter","Mã website chỉ có thể chứa các chữ cái (a-z), số (0-9) hoặc dấu gạch dưới (_), ký tự đầu tiên phải là chữ cái"
"Website with the same code","Website có cùng mã"
"Weekend Days","Ngày cuối tuần"
"Welcome Text","Văn bản chào mừng"
"Wrong file info format","Định dạng thông tin tệp sai"
"Wrong number of arguments for %s","Sai số đối cho %s"
"Wrong old style column type definition: {$definition}.","Định nghĩa sai loại cột: {$definition}."
"Yes","Có"
"You will have to log in after you save your custom admin path.","Bạn sẽ phải đăng nhập sau khi lưu đường dẫn quản trị tùy chỉnh."
"Your design change for the specified store intersects with another one, please specify another date range.","Thay đổi thiết kế của bạn cho cửa hàng trùng với cửa hàng khác, vui lòng xác định phạm vi ngày tháng khác."
"database ""%s""","dữ liệu ""%s"""
